{
  "$defs": {
    "ChannelValue": {
      "description": "A channel sample: a flat list of floats plus an optional unit string. Width\ncarries the semantics (1=scalar, 3=vec3, 4=quat, N=array).",
      "properties": {
        "data": {
          "default": [],
          "items": {
            "format": "double",
            "type": "number"
          },
          "type": "array"
        },
        "unit": {
          "default": null,
          "type": [
            "string",
            "null"
          ]
        }
      },
      "type": "object"
    },
    "StimulusFrame": {
      "description": "The values to inject this step (keyed by stimulus port).",
      "properties": {
        "kind": {
          "default": "",
          "type": "string"
        },
        "ncp_version": {
          "default": "",
          "type": "string"
        },
        "session_id": {
          "default": "",
          "type": "string"
        },
        "t": {
          "default": 0.0,
          "format": "double",
          "type": "number"
        },
        "values": {
          "additionalProperties": {
            "$ref": "#/$defs/ChannelValue"
          },
          "default": {},
          "type": "object"
        }
      },
      "type": "object"
    }
  },
  "$schema": "https://json-schema.org/draft/2020-12/schema",
  "description": "Advance one chunk; optional stimulus; returns an `ObservationFrame`.",
  "properties": {
    "advance_ms": {
      "default": null,
      "format": "double",
      "type": [
        "number",
        "null"
      ]
    },
    "kind": {
      "const": "step_request",
      "default": "",
      "type": "string"
    },
    "ncp_version": {
      "const": "0.6",
      "default": "",
      "type": "string"
    },
    "session_id": {
      "default": "",
      "type": "string"
    },
    "stimulus": {
      "anyOf": [
        {
          "$ref": "#/$defs/StimulusFrame"
        },
        {
          "type": "null"
        }
      ],
      "default": null
    }
  },
  "required": [
    "ncp_version",
    "session_id"
  ],
  "title": "StepRequest",
  "type": "object"
}
